{
  "schema_version": "1.0.0",
  "catalog_id": "multi_sdd_governance",
  "version": 1,
  "rules": [
    {
      "schema_version": "1.0.0",
      "rule_id": "GOV-CATALOG-INTEGRITY-001",
      "version": 1,
      "title": "Governance catalog must be structurally and referentially valid",
      "description": "The canonical catalog and deterministic check registry must validate, use unique identifiers, preserve approval authority, and contain no orphan check links.",
      "category": "governance",
      "status": "approved",
      "owner": "governance_gate",
      "default_severity": "high",
      "enforcement": { "mode": "deterministic", "gate_effect": "block", "automation": { "engine": "sdd_governance", "check_id": "governance_catalog_integrity" } },
      "scope": { "description": "The versioned governance catalog, registry, and schemas." },
      "exceptions_allowed": false,
      "source_refs": ["governance/README.md", "governance/schemas/v1/rule.schema.json"],
      "responsible_gate": "governance_gate",
      "evidence_requirements": ["Schema validation and catalog-to-check referential integrity results."],
      "approval": { "approved_by": { "kind": "human", "id": "gustavo", "runtime": "manual" }, "approved_at": "2026-08-13T18:00:00Z", "rationale": "Approved as the fail-closed catalog foundation.", "reference": "conversation:019ffbd4-b28d-7643-bdc2-168b0da1eb8f" }
    },
    {
      "schema_version": "1.0.0",
      "rule_id": "GOV-CODEX-ROLE-CATALOG-001",
      "version": 1,
      "title": "Codex must expose the complete governed role catalog",
      "description": "The supported Codex runtime must declare exactly the eight governed roles required by the canonical orchestration contract.",
      "category": "governance",
      "status": "approved",
      "owner": "governance_gate",
      "default_severity": "high",
      "enforcement": { "mode": "deterministic", "gate_effect": "block", "automation": { "engine": "sdd_governance", "check_id": "codex_role_catalog" } },
      "scope": { "description": "Codex agent templates in source, project, and global layouts." },
      "exceptions_allowed": false,
      "source_refs": ["docs/agent-governance-responsibility-map.md", "test/installer.test.js"],
      "responsible_gate": "governance_gate",
      "evidence_requirements": ["Normalized Codex role set matched to the canonical governed role inventory."],
      "approval": { "approved_by": { "kind": "human", "id": "gustavo", "runtime": "manual" }, "approved_at": "2026-08-13T22:48:19Z", "rationale": "Approved for the Codex-only governed role catalog.", "reference": "conversation:019ffd45-4de2-71a3-bcbe-68fb8fdee78c" }
    },
    {
      "schema_version": "1.0.0",
      "rule_id": "GOV-REVIEW-REPORTONLY-001",
      "version": 3,
      "title": "Independent reviewers must remain report-only",
      "description": "Architecture, quality, and security reviewers must remain report-only without implementation ownership. Managed reviewer declarations retain read-only profiles. In the explicitly authorized instruction-based MVP for multi-sdd-team source without installed managed prompts, native reviewers may inherit write-capable tools but are instructed not to mutate; technical separation is deferred, and before/after observation plus honest reporting is required.",
      "category": "governance",
      "status": "approved",
      "owner": "governance_gate",
      "default_severity": "critical",
      "enforcement": {
        "mode": "deterministic",
        "gate_effect": "block",
        "automation": {
          "engine": "sdd_governance",
          "check_id": "reviewer_report_only"
        }
      },
      "scope": {
        "description": "Codex architecture, quality, and security reviewer declarations."
      },
      "exceptions_allowed": false,
      "source_refs": [
        "docs/agent-governance-responsibility-map.md",
        "codex/agents/tester-reviewer.toml",
        "docs/scoped-pr-workflow.md"
      ],
      "responsible_gate": "governance_gate",
      "evidence_requirements": [
        "Reviewer declarations and explicit report-only instructions; for the source MVP, scoped handoff, version identity, before/after state observations and action records without unsupported authorship or isolation claims. Static declaration validation does not attest runtime capability restrictions."
      ],
      "approval": {
        "approved_by": {
          "kind": "human",
          "id": "gustavo",
          "runtime": "manual"
        },
        "approved_at": "2026-10-15T15:30:45Z",
        "rationale": "Approval recorded at this timestamp, not the original message time. The repository owner explicitly approved deferring technical reviewer-permission separation for an instruction-based MVP with clear scope and subsequent checks. This changes product policy only; platform restrictions, installed-prompt immutability, launcher blocking, independent ownership and v1 handoffs remain binding.",
        "reference": "human-decision:instruction-review-mvp-2026-10-15"
      }
    },
    {
      "schema_version": "1.0.0",
      "rule_id": "GOV-REVIEW-HANDOFF-001",
      "version": 2,
      "title": "Review handoffs must use the validated governance envelope",
      "description": "Reviewers must emit one pure JSON result with correct role, runtime, gate type, bounded evidence, and referential integrity.",
      "category": "governance",
      "status": "approved",
      "owner": "governance_gate",
      "default_severity": "high",
      "enforcement": { "mode": "deterministic", "gate_effect": "block", "automation": { "engine": "sdd_governance", "check_id": "review_handoff_contract" } },
      "scope": { "description": "Codex structured review prompts, schema validation, and fail-closed pipeline integration." },
      "exceptions_allowed": false,
      "source_refs": ["src/governance-validator.js", "governance/schemas/v1/agent-result.schema.json"],
      "responsible_gate": "governance_gate",
      "evidence_requirements": ["Codex prompt contracts, schema validation, and fail-closed pipeline integration."],
      "approval": { "approved_by": { "kind": "human", "id": "gustavo", "runtime": "manual" }, "approved_at": "2026-08-13T22:48:19Z", "rationale": "Approved to fail closed on invalid Codex independent review handoffs.", "reference": "conversation:019ffd45-4de2-71a3-bcbe-68fb8fdee78c" }
    },
    {
      "schema_version": "1.0.0",
      "rule_id": "GOV-PIPELINE-ORDER-001",
      "version": 1,
      "title": "Pipeline dependencies and failed gates must be enforced",
      "description": "Every declared dependency must exist and precede its consumer, cycles are forbidden, and dependent stages must not continue after invalid or failed gates.",
      "category": "process",
      "status": "approved",
      "owner": "governance_gate",
      "default_severity": "critical",
      "enforcement": { "mode": "deterministic", "gate_effect": "block", "automation": { "engine": "sdd_governance", "check_id": "pipeline_dependency_order" } },
      "scope": { "description": "All declared Codex pipeline strategies and hard rules." },
      "exceptions_allowed": false,
      "source_refs": ["codex/pipeline.json", "codex/AGENTS.md"],
      "responsible_gate": "governance_gate",
      "evidence_requirements": ["Dependency existence, ordering, acyclicity, and fail-closed policy evidence."],
      "approval": { "approved_by": { "kind": "human", "id": "gustavo", "runtime": "manual" }, "approved_at": "2026-08-13T18:00:00Z", "rationale": "Approved as the deterministic sequencing gate.", "reference": "conversation:019ffbd4-b28d-7643-bdc2-168b0da1eb8f" }
    },
    {
      "schema_version": "1.0.0",
      "rule_id": "GOV-MANAGED-PROMPT-PROTECTION-001",
      "version": 2,
      "title": "Managed prompts are immutable to AI-mediated work",
      "description": "Project-installed agent prompts must match the approved package baseline and remain non-writable under the effective managed Codex runtime; drift, legacy configuration, elevation, or missing evidence blocks that runtime. Canonical source checks validate declarations only. The explicitly authorized instruction-based MVP reviews multi-sdd-team source without installed managed prompts and makes no protected-runtime claim; it cannot modify installed prompts, enable the launcher, use test hooks, or override platform restrictions.",
      "category": "security",
      "status": "approved",
      "owner": "governance_gate",
      "default_severity": "critical",
      "enforcement": {
        "mode": "deterministic",
        "gate_effect": "block",
        "automation": {
          "engine": "sdd_governance",
          "check_id": "managed_prompt_protection"
        }
      },
      "scope": {
        "description": "Canonical prompt contracts and project-installed .codex/agents files in supported Codex workflows."
      },
      "exceptions_allowed": false,
      "source_refs": [
        "src/prompt-protection.js",
        "src/installer.js",
        "codex/agents",
        "codex/AGENTS.md",
        "docs/scoped-pr-workflow.md"
      ],
      "responsible_gate": "governance_gate",
      "evidence_requirements": [
        "For installed managed execution: canonical prompt digests, physical path safety, safe permission profile identity and effective write-boundary evidence. For package source: unchanged protection declarations and explicit separation of the instruction-based MVP from managed execution; source checks do not attest a live runtime."
      ],
      "approval": {
        "approved_by": {
          "kind": "human",
          "id": "gustavo",
          "runtime": "manual"
        },
        "approved_at": "2026-10-15T15:30:45Z",